{
  "artifact_type": "formal_evidence_declarations",
  "benchmark_release_id": "aftermathbench-2026.08-r1",
  "control_evidence": {
    "minimum_task_pass_rate": 0.8,
    "path": "data/evidence/formal/aftermathbench-2026.08-r1/kubernetes/k8s-constraint-interaction-recovery/dev-006/completion/roles/execution_control/support/summary.json",
    "sha256": "2d0b918036c3a6454d0c8bf9302f8d1140d0a14d6170e4dcfcc138ac0aeab9bb"
  },
  "domain_id": "kubernetes",
  "family_id": "k8s-constraint-interaction-recovery",
  "formal_evidence": {
    "boundary_bundle": {
      "path": "data/evidence/formal/aftermathbench-2026.08-r1/kubernetes/k8s-constraint-interaction-recovery/dev-006/roles/boundary_bundle/envelope.json",
      "sha256": "aeb723ad1bca46587355317553b0258e2b62cc53d93db8f76abf18b2526e2ef0"
    },
    "evaluator": {
      "path": "data/evidence/formal/aftermathbench-2026.08-r1/kubernetes/k8s-constraint-interaction-recovery/dev-006/roles/evaluator/envelope.json",
      "sha256": "b8b3dad2b5fcc7183edcec0781423f5877ef290ffa5d4f6a0f17fa9a971854b8"
    },
    "execution_control": {
      "path": "data/evidence/formal/aftermathbench-2026.08-r1/kubernetes/k8s-constraint-interaction-recovery/dev-006/completion/roles/execution_control/envelope.json",
      "sha256": "4eb0a94a9d049bcf57c46e6cf279f1e1ae71a93df211442d3e66acabbc53a3a6"
    },
    "raw_run_archive": {
      "path": "data/evidence/formal/aftermathbench-2026.08-r1/kubernetes/k8s-constraint-interaction-recovery/dev-006/completion/roles/raw_run_archive/envelope.json",
      "sha256": "e42389b8b7c5946ded00b0c04d60c5013b70d39b0c0bdca4fba44ef61612e268"
    },
    "reference_bundle": {
      "path": "data/evidence/formal/aftermathbench-2026.08-r1/kubernetes/k8s-constraint-interaction-recovery/dev-006/roles/reference_bundle/envelope.json",
      "sha256": "91540afef3a70f404fff6f5f5a1d2a4d91b69d185cfb828f215f56350bc7d878"
    },
    "reset_evidence": {
      "path": "data/evidence/formal/aftermathbench-2026.08-r1/kubernetes/k8s-constraint-interaction-recovery/dev-006/roles/reset_evidence/envelope.json",
      "sha256": "c2fc7f09749793dd1164d1fbab37f4351761ad3a2311b2fc60b9421c5d294c4a"
    },
    "tool_contract": {
      "path": "data/evidence/formal/aftermathbench-2026.08-r1/kubernetes/k8s-constraint-interaction-recovery/dev-006/roles/tool_contract/envelope.json",
      "sha256": "78c5dfbeb5705541a07399f92e231c3858ba335609d5871ff7caf404130a7f64"
    }
  },
  "formal_input_lock": {
    "path": "data/evidence/formal/aftermathbench-2026.08-r1/kubernetes/k8s-constraint-interaction-recovery/dev-006/formal-input-lock.json",
    "sha256": "36c2b6abd610c027d5ba7e554618c53380352145fb3dd72a479746d84b06db37"
  },
  "instance_id": "dev-006",
  "producer_commit": "ddd961344ba7390744f509b8d6a76ac97a5c24cc",
  "scenario_id": "k8s-constraint-interactions-public-dev-006",
  "scenario_path": "data/scenarios/public-dev-slot-003/scenario.json",
  "schema_version": "1.0",
  "variant_ids": [
    "state_01",
    "state_02",
    "state_03",
    "state_04",
    "state_05",
    "state_06",
    "state_07",
    "state_08",
    "state_09",
    "state_10",
    "state_11",
    "state_12",
    "state_13"
  ]
}
